{
  "$schema": "https://json-schema.org/draft/2020-12/schema",
  "$id": "https://military-logistics-sim/schemas/scenario.schema.json",
  "title": "Scenario",
  "type": "object",
  "required": [
    "scenarioId",
    "name",
    "startTime",
    "tickRateSeconds",
    "durationMinutes",
    "nodes",
    "routes",
    "assets",
    "shipments",
    "incidentSeeds"
  ],
  "properties": {
    "scenarioId": { "type": "string", "minLength": 1 },
    "name": { "type": "string", "minLength": 1 },
    "startTime": { "type": "string", "format": "date-time" },
    "tickRateSeconds": { "type": "integer", "minimum": 1 },
    "durationMinutes": { "type": "integer", "minimum": 1 },
    "terrainReference": { "type": "string" },
    "rulesetId": { "type": "string" },
    "realism": {
      "type": "object",
      "properties": {
        "reportingQuality": { "type": "number", "minimum": 0, "maximum": 1 },
        "sustainmentRhythmAdherence": { "type": "number", "minimum": 0, "maximum": 1 },
        "configuredLoadQuality": { "type": "number", "minimum": 0, "maximum": 1 },
        "maintenanceDiscipline": { "type": "number", "minimum": 0, "maximum": 1 },
        "securityDiscipline": { "type": "number", "minimum": 0, "maximum": 1 },
        "crewEnduranceHours": { "type": "number", "exclusiveMinimum": 0 },
        "useAssistantDrivers": { "type": "boolean" }
      },
      "additionalProperties": false
    },
    "nodes": { "type": "array", "items": { "$ref": "./node.schema.json" } },
    "routes": { "type": "array", "items": { "$ref": "./route.schema.json" } },
    "assets": { "type": "array", "items": { "$ref": "./asset.schema.json" } },
    "shipments": { "type": "array", "items": { "$ref": "./shipment.schema.json" } },
    "incidentSeeds": { "type": "array", "items": { "$ref": "./incident-seed.schema.json" } }
  },
  "additionalProperties": false
}
